{
  "bandCuts": [
    {
      "band": "X",
      "max": 19,
      "min": 0
    },
    {
      "band": "A",
      "max": 30,
      "min": 20
    },
    {
      "band": "B",
      "max": 42,
      "min": 31
    },
    {
      "band": "C",
      "max": 51,
      "min": 43
    },
    {
      "band": "E",
      "max": 55,
      "min": 52
    }
  ],
  "id": "fr-writing-supervised-v2",
  "itemIds": [
    "41BJST37AG10Q3LDGD92",
    "4RKI2UPOOP2EAI311I5I",
    "8B9FAVOBJ8MCOL3IIGD2",
    "3K4S60IE62P12DDO7D89",
    "73PJQ3ILNR7S37DM83LV",
    "73T85708FLH4OTC4QT09",
    "17JPJN35VIO4UD18HV1P",
    "5GAD8ONBE2PN0MLLQA1E",
    "1VFLERFQVNIJGBEI67QA",
    "7PM1O2O43FDL91BURGRP",
    "5AIK2VFHI8TBCCJM7M31",
    "396UJQNJN0RES4T6AJG6",
    "8J9J7A2HNI0STMIB93EL",
    "D24FTV370C3NHTU6JUHC",
    "9IN6ANKO3QCDJ5LS8TVE",
    "3FR63MPSS6TLFD335EK8",
    "AM6AHC58G5FJOF6BUDUA",
    "245HE5ESQL6I5ORD7PSP",
    "20JNFFGOVNHDOSCM4U46",
    "1HJ13AO68H0FERMSSVPU",
    "3JGTO6QQQDEAJMCEOLKE",
    "1MOTH5LD7E7T80RVRCUP",
    "6E8VSR9TUJE8R5AH2D72",
    "1002J2L1H6VU897D17G7",
    "7PLD7354UCQHCF2PITJK",
    "A6U3C6DACOA21RNIGRPB",
    "E5FQ0CKARM0KFVHO23QP",
    "BDT2DBIA06IICPT7OD1N",
    "4HUS9608EJVH2C6CO9HN",
    "8SIV5TQFC5HB4ORA6E8O",
    "2VERN2E2NGE8T490MJJE",
    "A2QU95KRCM3IBJKSTF48",
    "CPDT5LEJEF13QOQLGLTP",
    "4RK10RFH4KQ6PU6AS7Q2",
    "7UTLCDFTNQ3Q0KBBM4BQ",
    "BRGQ12I8JOOBK3CDC4KF",
    "63N5KJLN9R74CEH68IDF",
    "4GNHAKUHOQ58APLMQLN4",
    "20PFPVI69ISBKQBPQITM",
    "BFO56LILHLFLL47HNRCQ",
    "AE7V33TQTU568BVDRRB3",
    "OPIT2B464EEN2UNUS1VV",
    "9I46FS6N2NBFI873SE3G",
    "2F7K6NJBDQEFRSPIVIJT",
    "FN6DOA5AMQHJUJOV1H2C",
    "7HEIL9MOC0FNDMERP75D",
    "CIRPA7LAHJ3KS10QS26E",
    "5CDDI3J7A7T8V4GD0GH1",
    "1HU7H75H869J3OH63GFL",
    "6DTJ4RIT60JMA2GCSJAB",
    "1Q4MAF3G88FB3V2068DC",
    "ERC2699Q887V2NMUKTH9",
    "FH4OVOPC02DMPMMCCJO2",
    "N3U54NGT9PR05VG7OLVE",
    "4CLS6I7PCGNRF6P8MV3K",
    "9LCFI7VLHV6GS1MEQS77",
    "15JAFT2GHD01DFNFHUM0",
    "A7FEOKHVFRCS531F5MG1",
    "6GBFFJMGPO0E4M4F9T68",
    "96679TQ4GD55N8PJ2A4Q",
    "EBG2I31DN3A9HO8II7MO",
    "8LIA8104TEQRK3A71LJP",
    "D25KK8AKB1SK8U7OOE5P",
    "626DGJR6J7S65T4OJEA5",
    "6HLI1TLJ53S2C4BOCO9I"
  ],
  "lang": "fr",
  "mode": "supervised",
  "pilotItemIds": [
    "3K4S60IE62P12DDO7D89",
    "7PM1O2O43FDL91BURGRP",
    "AM6AHC58G5FJOF6BUDUA",
    "6E8VSR9TUJE8R5AH2D72",
    "8SIV5TQFC5HB4ORA6E8O",
    "BRGQ12I8JOOBK3CDC4KF",
    "9I46FS6N2NBFI873SE3G",
    "1HU7H75H869J3OH63GFL",
    "9LCFI7VLHV6GS1MEQS77",
    "8LIA8104TEQRK3A71LJP"
  ],
  "skill": "writing",
  "timeLimitMinutes": 90,
  "version": 2
}
