{
  "bandCuts": [
    {
      "band": "X",
      "max": 17,
      "min": 0
    },
    {
      "band": "A",
      "max": 27,
      "min": 18
    },
    {
      "band": "B",
      "max": 37,
      "min": 28
    },
    {
      "band": "C",
      "max": 44,
      "min": 38
    },
    {
      "band": "E",
      "max": 50,
      "min": 45
    }
  ],
  "id": "fr-reading-supervised-v3",
  "itemIds": [
    "1BTV0RJ9EJ5M3ST4H7CI",
    "2K1H9S6T2CU1TO3IFPCS",
    "1VQ694DCTM6HKE3D15DT",
    "6O075875NDQ3JV9NA1IO",
    "APSURVCDSC6SE98RVPLJ",
    "5AD54OSBNJ3EM75VGE8O",
    "2R30MDNPAOOI14Q6H0TJ",
    "9J6OQSVU5Q3566RS9IOU",
    "JJKM0TKJ5O7ANVNTLR9Q",
    "CECT575G640FNSUT8688",
    "D770586S7NJHVD7NAC7D",
    "2RJCNLEGQ5OT3N0CVS3D",
    "936168BG9U5M3S3SCVB4",
    "3JDA7KH784FKE7OCFAFR",
    "4OBQHOEJHTO6SC6L9AV9",
    "F7SKEE89B67V5GFVU3G4",
    "C9RT94FHLF3TBTSHD26R",
    "CN9TSRJC3LS98TO9HOUM",
    "12C46JOIBJF2EGIG9MUG",
    "B3KE3DTNID48H1RP2JVD",
    "BT7M4OCQCR5LS538RDKP",
    "COTQ6NE615DN2C91T2U3",
    "9J3U1FHMCF5GVNTPVBEV",
    "60UGKG957777DF1U50HM",
    "U2NA33RLO54EV1GOEANQ",
    "47AS4LANJ3GR5L8DCQN2",
    "6G5358MDKHL5JDM4BL86",
    "3A5JUQNARFS1O7S877PL",
    "CA27IASDMJ5DU9IRAMKE",
    "36S2JP6KDM6818S6L0N5",
    "2JDVAPORFGRVAI40DEO9",
    "85QTJOLM0N2FPURNMQ1H",
    "1VE2D6EACV3N6IN80ODH",
    "FJ6T02U8L4MM063EHMBJ",
    "3DP1MAE8VCQS1Q47KDP8",
    "65ONJ89G64IOOD66UTCJ",
    "6S1TF0BS45H5FK1ODFSJ",
    "4E2GOA800TCVN71IKMS1",
    "95OJAC4REN26GEAJ83QR",
    "ACTULGAO2960N7LUGD5U",
    "CBMBGVKMDCQHTT93D323",
    "BLL51LMGPQJ9GPA2H0TS",
    "ADKH3O0ICSIKBROPCH5V",
    "F2G8MF5OAQLH4FUOHTTH",
    "8C406OGSP0RLAMBNA81H",
    "1JCNUUFA69SCNORGHQ7R",
    "1TFMV4DN9GT81M6DQ449",
    "CMS6HTGE8JEHODP6K9KU",
    "6MJNCVKOS0B8R7ARB6CM",
    "F32KN9IQLK29BB7KRFJH",
    "C4JJTJIPL0EGVIMP30J3",
    "4SUH3LCEIJUV9TCA682U",
    "5N4ISA7IUI8JHF708COA",
    "7VSD7QT828CH8UQPIUPO",
    "1FRMCOPQELK955R5D9IV",
    "5PMLC3TM5RNCLDF7KQ16",
    "7KQVMMHCBSSHSMQN8KJO",
    "9SUO5N01NPD7FLCJE3LA",
    "76FK52QE4EL8NRO046F9",
    "BC7E07TSPRSRB80RJ4D5"
  ],
  "lang": "fr",
  "mode": "supervised",
  "pilotItemIds": [
    "6O075875NDQ3JV9NA1IO",
    "CECT575G640FNSUT8688",
    "F7SKEE89B67V5GFVU3G4",
    "COTQ6NE615DN2C91T2U3",
    "3A5JUQNARFS1O7S877PL",
    "FJ6T02U8L4MM063EHMBJ",
    "ACTULGAO2960N7LUGD5U",
    "1JCNUUFA69SCNORGHQ7R",
    "4SUH3LCEIJUV9TCA682U",
    "9SUO5N01NPD7FLCJE3LA"
  ],
  "skill": "reading",
  "timeLimitMinutes": 90,
  "version": 3
}
