{
  "bandCuts": [
    {
      "band": "X",
      "max": 19,
      "min": 0
    },
    {
      "band": "A",
      "max": 30,
      "min": 20
    },
    {
      "band": "B",
      "max": 42,
      "min": 31
    },
    {
      "band": "C",
      "max": 51,
      "min": 43
    },
    {
      "band": "E",
      "max": 55,
      "min": 52
    }
  ],
  "id": "fr-writing-supervised-v3",
  "itemIds": [
    "3JGTO6QQQDEAJMCEOLKE",
    "8LIA8104TEQRK3A71LJP",
    "5QBR3EP2E4F3KHHI76G0",
    "1002J2L1H6VU897D17G7",
    "3NH4CC2HMQUELNJUS46P",
    "A6U3C6DACOA21RNIGRPB",
    "6F3B38QCOFROU42IO29R",
    "BDT2DBIA06IICPT7OD1N",
    "4HUS9608EJVH2C6CO9HN",
    "7PM1O2O43FDL91BURGRP",
    "D92A1HPV0RRP5U23VUFH",
    "8D4S85ADORGN5A6MVSFF",
    "94MUOL8CV436QL4BS88P",
    "95B81CDTRGHQFI0J539D",
    "9PJI31CV9009L23S59JN",
    "BRGQ12I8JOOBK3CDC4KF",
    "AM6AHC58G5FJOF6BUDUA",
    "A7FEOKHVFRCS531F5MG1",
    "6GBFFJMGPO0E4M4F9T68",
    "96679TQ4GD55N8PJ2A4Q",
    "EVM9A9BR5STRLB8OE73D",
    "OPIT2B464EEN2UNUS1VV",
    "FTENLOO9ICQB12LETVRL",
    "DKSFERLU44A2QMTT8RIS",
    "E0GF4HF6QNNINQ07US1T",
    "B06TUOCFT4S9KINQT3AE",
    "CIRPA7LAHJ3KS10QS26E",
    "JPED8VRBSHLKJFUE33IL",
    "BBPFKJIA3OIGCE6N6Q0I",
    "6CDT7UT2F1LB8V7LAVL4",
    "5AIK2VFHI8TBCCJM7M31",
    "ERC2699Q887V2NMUKTH9",
    "C4ILT9988SS2GUPMPUIN",
    "FNEEV87HV5PHIBEVJSMR",
    "9IN6ANKO3QCDJ5LS8TVE",
    "EOJK010VRLCJ6RAF3M6B",
    "63N5KJLN9R74CEH68IDF",
    "245HE5ESQL6I5ORD7PSP",
    "20JNFFGOVNHDOSCM4U46",
    "1IBVDEUL1TNFKB2L0TEB",
    "EBG2I31DN3A9HO8II7MO",
    "87ECP42064M8RI7T5Q4D",
    "3COJ6DC16BPD3RG6SD9E",
    "9RO9JJ738RVTJDPKI5RS",
    "AS84417T5L3IPCHN0QBT",
    "BQHHKGJQ97T5K29JURLF",
    "17JPJN35VIO4UD18HV1P",
    "61MMLO1F4BGOSBMPES3E",
    "9SVNR98HC4UAUIUQAT3H",
    "3UP6RB2F4JI79U3766DE",
    "4OI2RLIBKC06ECDJM1RG",
    "6TUM866AMU6SGE144U07",
    "CPDT5LEJEF13QOQLGLTP",
    "4RK10RFH4KQ6PU6AS7Q2",
    "6D7FPQN698C2N0H1S760",
    "1S6SPJDVI774BRFJ9M4U",
    "15JAFT2GHD01DFNFHUM0",
    "4GNHAKUHOQ58APLMQLN4",
    "20PFPVI69ISBKQBPQITM",
    "BG45NK25FNBQ4R86BLS1",
    "41BJST37AG10Q3LDGD92",
    "8DF145HQ89O7C35OG93T",
    "D25KK8AKB1SK8U7OOE5P",
    "3K4S60IE62P12DDO7D89",
    "3VT5EA4K2NBP2TS3PMQH"
  ],
  "lang": "fr",
  "mode": "supervised",
  "pilotItemIds": [
    "1002J2L1H6VU897D17G7",
    "7PM1O2O43FDL91BURGRP",
    "AM6AHC58G5FJOF6BUDUA",
    "FTENLOO9ICQB12LETVRL",
    "6CDT7UT2F1LB8V7LAVL4",
    "EOJK010VRLCJ6RAF3M6B",
    "3COJ6DC16BPD3RG6SD9E",
    "9SVNR98HC4UAUIUQAT3H",
    "1S6SPJDVI774BRFJ9M4U",
    "8DF145HQ89O7C35OG93T"
  ],
  "skill": "writing",
  "timeLimitMinutes": 90,
  "version": 3
}
