{
  "bandCuts": [
    {
      "band": "X",
      "max": 17,
      "min": 0
    },
    {
      "band": "A",
      "max": 27,
      "min": 18
    },
    {
      "band": "B",
      "max": 37,
      "min": 28
    },
    {
      "band": "C",
      "max": 44,
      "min": 38
    },
    {
      "band": "E",
      "max": 50,
      "min": 45
    }
  ],
  "id": "fr-reading-supervised-v2",
  "itemIds": [
    "5TLP701HFB7A9FKR8F7H",
    "4SUH3LCEIJUV9TCA682U",
    "C4JJTJIPL0EGVIMP30J3",
    "4CHO8IJGNOMBRN0QD11L",
    "76684IK856LGDU23JF81",
    "C9RT94FHLF3TBTSHD26R",
    "F7SKEE89B67V5GFVU3G4",
    "CN9TSRJC3LS98TO9HOUM",
    "26DC5JUCHPTRPGM22VSV",
    "BT7M4OCQCR5LS538RDKP",
    "9J3U1FHMCF5GVNTPVBEV",
    "B3KE3DTNID48H1RP2JVD",
    "COTQ6NE615DN2C91T2U3",
    "7NOFH3EE4P08LN5FURPM",
    "60UGKG957777DF1U50HM",
    "U2NA33RLO54EV1GOEANQ",
    "APSURVCDSC6SE98RVPLJ",
    "6O075875NDQ3JV9NA1IO",
    "2K1H9S6T2CU1TO3IFPCS",
    "PO8HM84A6AUQ060ELNVU",
    "4MJ491JQ5VTJU773H9CV",
    "8SJ4MQ5OCOIUCRDJF9EJ",
    "95OJAC4REN26GEAJ83QR",
    "2D7SBP4GULPP09BM82TQ",
    "BLL51LMGPQJ9GPA2H0TS",
    "CBMBGVKMDCQHTT93D323",
    "20NPKO9A62G2NATLF56H",
    "9SUO5N01NPD7FLCJE3LA",
    "8RCDQ0OUTL9QGRCCEAQC",
    "7ILD97ESUD2T6HONOF36",
    "7KQVMMHCBSSHSMQN8KJO",
    "1VE2D6EACV3N6IN80ODH",
    "FJ6T02U8L4MM063EHMBJ",
    "85QTJOLM0N2FPURNMQ1H",
    "65ONJ89G64IOOD66UTCJ",
    "6S1TF0BS45H5FK1ODFSJ",
    "3DP1MAE8VCQS1Q47KDP8",
    "5SMQKK1E8K871T1MR82F",
    "6MJNCVKOS0B8R7ARB6CM",
    "CMS6HTGE8JEHODP6K9KU",
    "1TFMV4DN9GT81M6DQ449",
    "9J6OQSVU5Q3566RS9IOU",
    "5AD54OSBNJ3EM75VGE8O",
    "JJKM0TKJ5O7ANVNTLR9Q",
    "CECT575G640FNSUT8688",
    "7VSD7QT828CH8UQPIUPO",
    "1FRMCOPQELK955R5D9IV",
    "5PMLC3TM5RNCLDF7KQ16",
    "8C406OGSP0RLAMBNA81H",
    "F2G8MF5OAQLH4FUOHTTH",
    "1JCNUUFA69SCNORGHQ7R",
    "EQEFVLITA96O2MLFFGP3",
    "CA27IASDMJ5DU9IRAMKE",
    "3A5JUQNARFS1O7S877PL",
    "54DKNVGL9G75QNHPVS3A",
    "47AS4LANJ3GR5L8DCQN2",
    "936168BG9U5M3S3SCVB4",
    "D770586S7NJHVD7NAC7D",
    "3JDA7KH784FKE7OCFAFR",
    "2JDVAPORFGRVAI40DEO9"
  ],
  "lang": "fr",
  "mode": "supervised",
  "pilotItemIds": [
    "4CHO8IJGNOMBRN0QD11L",
    "BT7M4OCQCR5LS538RDKP",
    "U2NA33RLO54EV1GOEANQ",
    "8SJ4MQ5OCOIUCRDJF9EJ",
    "9SUO5N01NPD7FLCJE3LA",
    "85QTJOLM0N2FPURNMQ1H",
    "CMS6HTGE8JEHODP6K9KU",
    "7VSD7QT828CH8UQPIUPO",
    "EQEFVLITA96O2MLFFGP3",
    "D770586S7NJHVD7NAC7D"
  ],
  "skill": "reading",
  "timeLimitMinutes": 90,
  "version": 2
}
