{
  "bandCuts": [
    {
      "band": "X",
      "max": 19,
      "min": 0
    },
    {
      "band": "A",
      "max": 30,
      "min": 20
    },
    {
      "band": "B",
      "max": 42,
      "min": 31
    },
    {
      "band": "C",
      "max": 51,
      "min": 43
    },
    {
      "band": "E",
      "max": 55,
      "min": 52
    }
  ],
  "id": "fr-writing-supervised-v4",
  "itemIds": [
    "claude-w-verb-tense-and-mood-03",
    "claude-w-agreement-29",
    "claude-w-prepositions-and-government-02",
    "claude-w-pronouns-31",
    "claude-w-connectors-and-discourse-markers-20",
    "claude-w-register-and-formality-15",
    "claude-w-word-choice-precision-19",
    "claude-w-false-friends-and-anglicisms-22",
    "claude-w-punctuation-and-mechanics-01",
    "claude-w-sentence-structure-26",
    "claude-w-verb-tense-and-mood-13",
    "claude-w-agreement-04",
    "claude-w-prepositions-and-government-29",
    "claude-w-pronouns-25",
    "claude-w-connectors-and-discourse-markers-33",
    "claude-w-register-and-formality-09",
    "claude-w-word-choice-precision-15",
    "claude-w-false-friends-and-anglicisms-32",
    "claude-w-punctuation-and-mechanics-25",
    "claude-w-sentence-structure-13",
    "claude-w-verb-tense-and-mood-26",
    "claude-w-agreement-32",
    "claude-w-prepositions-and-government-17",
    "claude-w-pronouns-22",
    "claude-w-connectors-and-discourse-markers-32",
    "claude-w-register-and-formality-06",
    "claude-w-word-choice-precision-09",
    "claude-w-false-friends-and-anglicisms-33",
    "claude-w-punctuation-and-mechanics-22",
    "claude-w-sentence-structure-10",
    "claude-w-verb-tense-and-mood-02",
    "claude-w-agreement-13",
    "claude-w-prepositions-and-government-04",
    "claude-w-pronouns-06",
    "claude-w-connectors-and-discourse-markers-18",
    "claude-w-register-and-formality-26",
    "claude-w-word-choice-precision-30",
    "claude-w-false-friends-and-anglicisms-29",
    "claude-w-punctuation-and-mechanics-04",
    "claude-w-sentence-structure-04",
    "claude-w-verb-tense-and-mood-22",
    "claude-w-agreement-20",
    "claude-w-prepositions-and-government-08",
    "claude-w-pronouns-03",
    "claude-w-connectors-and-discourse-markers-23",
    "claude-w-register-and-formality-25",
    "claude-w-word-choice-precision-18",
    "claude-w-false-friends-and-anglicisms-01",
    "claude-w-punctuation-and-mechanics-12",
    "claude-w-sentence-structure-28",
    "claude-w-verb-tense-and-mood-25",
    "claude-w-agreement-12",
    "claude-w-prepositions-and-government-20",
    "claude-w-pronouns-02",
    "claude-w-connectors-and-discourse-markers-22",
    "claude-w-register-and-formality-29",
    "claude-w-word-choice-precision-13",
    "claude-w-false-friends-and-anglicisms-07",
    "claude-w-punctuation-and-mechanics-19",
    "claude-w-sentence-structure-09",
    "claude-w-verb-tense-and-mood-17",
    "claude-w-agreement-14",
    "claude-w-prepositions-and-government-12",
    "claude-w-pronouns-30",
    "claude-w-connectors-and-discourse-markers-07"
  ],
  "lang": "fr",
  "mode": "supervised",
  "pilotItemIds": [
    "claude-w-pronouns-31",
    "claude-w-sentence-structure-26",
    "claude-w-word-choice-precision-15",
    "claude-w-prepositions-and-government-17",
    "claude-w-sentence-structure-10",
    "claude-w-register-and-formality-26",
    "claude-w-prepositions-and-government-08",
    "claude-w-punctuation-and-mechanics-12",
    "claude-w-register-and-formality-29",
    "claude-w-agreement-14"
  ],
  "skill": "writing",
  "timeLimitMinutes": 90,
  "version": 4
}
