{
  "bandCuts": [
    {
      "band": "X",
      "max": 17,
      "min": 0
    },
    {
      "band": "A",
      "max": 27,
      "min": 18
    },
    {
      "band": "B",
      "max": 37,
      "min": 28
    },
    {
      "band": "C",
      "max": 44,
      "min": 38
    },
    {
      "band": "E",
      "max": 50,
      "min": 45
    }
  ],
  "id": "fr-reading-supervised-v4",
  "itemIds": [
    "claude-r-accessibility-2-1",
    "claude-r-accessibility-2-4",
    "claude-r-accessibility-2-5",
    "claude-r-accessibility-1-2",
    "claude-r-accessibility-1-1",
    "claude-r-accessibility-1-5",
    "claude-r-policy-and-legislation-2-5",
    "claude-r-policy-and-legislation-2-1",
    "claude-r-communications-1-4",
    "claude-r-policy-and-legislation-1-4",
    "claude-r-policy-and-legislation-1-2",
    "claude-r-environment-2-5",
    "claude-r-environment-2-3",
    "claude-r-finance-and-budgets-2-5",
    "claude-r-human-resources-1-3",
    "claude-r-human-resources-1-4",
    "claude-r-human-resources-1-1",
    "claude-r-procurement-4-1",
    "claude-r-project-management-5-1",
    "claude-r-health-and-safety-4-1",
    "claude-r-policy-and-legislation-3-3",
    "claude-r-policy-and-legislation-3-1",
    "claude-r-policy-and-legislation-5-2",
    "claude-r-policy-and-legislation-5-4",
    "claude-r-official-languages-4-5",
    "claude-r-it-and-digital-4-2",
    "claude-r-it-and-digital-4-1",
    "claude-r-human-resources-2-3",
    "claude-r-human-resources-2-5",
    "claude-r-human-resources-2-4",
    "claude-r-official-languages-1-5",
    "claude-r-it-and-digital-3-1",
    "claude-r-accessibility-4-1",
    "claude-r-health-and-safety-3-2",
    "claude-r-environment-5-3",
    "claude-r-procurement-5-3",
    "claude-r-procurement-5-5",
    "claude-r-procurement-5-1",
    "claude-r-it-and-digital-5-3",
    "claude-r-environment-4-5",
    "claude-r-human-resources-4-1",
    "claude-r-human-resources-4-5",
    "claude-r-environment-1-2",
    "claude-r-official-languages-2-3",
    "claude-r-official-languages-2-4",
    "claude-r-health-and-safety-1-5",
    "claude-r-project-management-1-4",
    "claude-r-project-management-1-5",
    "claude-r-health-and-safety-2-5",
    "claude-r-it-and-digital-1-3",
    "claude-r-it-and-digital-1-2",
    "claude-r-service-delivery-3-1",
    "claude-r-communications-4-5",
    "claude-r-health-and-safety-5-3",
    "claude-r-human-resources-3-3",
    "claude-r-accessibility-5-3",
    "claude-r-project-management-2-4",
    "claude-r-service-delivery-1-3",
    "claude-r-procurement-3-1",
    "claude-r-finance-and-budgets-3-3"
  ],
  "lang": "fr",
  "mode": "supervised",
  "pilotItemIds": [
    "claude-r-accessibility-1-2",
    "claude-r-policy-and-legislation-1-4",
    "claude-r-human-resources-1-4",
    "claude-r-policy-and-legislation-3-1",
    "claude-r-human-resources-2-3",
    "claude-r-health-and-safety-3-2",
    "claude-r-environment-4-5",
    "claude-r-health-and-safety-1-5",
    "claude-r-service-delivery-3-1",
    "claude-r-service-delivery-1-3"
  ],
  "skill": "reading",
  "timeLimitMinutes": 90,
  "version": 4
}
